{
  "asset_id": "10000000-0000-4000-8000-000000000001",
  "identity": {
    "manufacturer": "Synthetic Systems",
    "serial_number": "SYNTHETIC-ASSET-001"
  },
  "asset_type": "network-appliance",
  "aliases": [
    {
      "type": "hostname",
      "value": "synthetic-edge-collision.example.invalid",
      "valid_from": "2026-07-24T00:00:00Z",
      "source": "synthetic-asset-corpus",
      "confidence": 0.5
    },
    {
      "type": "ip",
      "value": "192.0.2.21",
      "valid_from": "2026-07-24T00:00:00Z",
      "source": "synthetic-asset-corpus",
      "confidence": 0.9
    }
  ],
  "created_at": "2026-07-24T00:00:00Z",
  "updated_at": "2026-07-24T00:00:00Z"
}
