{
  "asset_id": "10000000-0000-4000-8000-000000000003",
  "identity": {
    "manufacturer": "Example Storage",
    "serial_number": "SYNTHETIC-ASSET-003"
  },
  "asset_type": "storage-appliance",
  "aliases": [
    {
      "type": "fqdn",
      "value": "synthetic-storage-001.example.invalid",
      "valid_from": "2026-07-24T00:00:00Z",
      "source": "synthetic-asset-corpus",
      "confidence": 1.0
    },
    {
      "type": "asset_tag",
      "value": "SYNTHETIC-TAG-003",
      "valid_from": "2026-07-24T00:00:00Z",
      "source": "synthetic-asset-corpus",
      "confidence": 1.0
    }
  ],
  "created_at": "2026-07-24T00:00:00Z",
  "updated_at": "2026-07-24T00:00:00Z"
}
